id,type,text1,text2,text3,notes
oas_phasey,SHIP,"A pure special operations ship that is capable of operating deep within enemy territory. Panther-class can carry out marine ground attacks, deliver tactical bombardments and handle secret logistic operations and surprise attacks.

Panther is not designed for direct battle, the two medium ballistic hardpoints it has are mainly for self-defense against smaller vessels. The preferred battle routine is to quickly deliver all the explosive ordnance it has and leave the battlefield ASAP.

A Unicorn-class hull was selected to work as the base for its familiarity along with the Alliance forces. Two modernized gremlin phase coils were slotted on the hull design, with the aid of few bribed Tritachyon employees. Angled surfaces and hidden weapon bays in addition to the phase technology let it operate with a very small radar signature.

The unique array of capabilities enabled the Osiris Alliance to develop the power it has now. Many of the Hegemony response fleets sent after the declaration of independence had weird catastrophic logistic supply failures. Newest data leaks have revealed that these failures were caused by Panther fleets.",,,
oas_blaster_drone,SHIP,"A semi-autonomous mining shuttle equipped with a Mining Blaster and a small cargo bay to transport material back to the mothership. The pilot's main task is to supervise the Mining Blaster, ensure it's not pointed at the wrong target. The second task is to handle the retrieval of possible valuables after the Spitter has pulverized the target.",,,
oas_turtle2,SHIP,"A heavy-duty fighter meant to empty the surrounding space from other fighters. Dual Star Sprayers, along with a shield penetrating Magnetron cannon is enough firepower to bring down anything smaller than a frigate. Heavy armor ensures the Turtle survives the engagement.",,,
toopo_bucket,SHIP,A combination of several civilian hull pieces bolted and welded together make Butcher a cheap destroyer alternative. And a deadly surprise for bigger and slower targets. Carries a huge makeshift Dogleg antimatter torpedo made out of a Hound engine. Dogleg hit stop anything but the biggest ships on a direct hull hit. Two medium ballistic mounts give mediocre firepower advantage over frigates. Equipped with burn drive capable Tarsus engines. A capable pilot utilizes the burn drive and the Dogleg to bring down bigger fish.,,,
toopo_colosseum,SHIP,"If you want to field massive amounts of cheap fighter wings, on a cheap platform, Colosseum is a perfect ship. A colossus freighter has been cut in pieces and rearranged to support four fighter bays. Due to the makeshift design. Colosseum is unable to support a full capacity of higher quality fighters. It has a weak shield and only four small ballistic weapon slots to defend against the weakest attackers. It is incapable of standing in the line of battle. A damper field generator has been installed to give escorting ships time to help if Colosseum finds itself in a too-tight spot.

Colosseum was a heavily used carrier by the Osiris Alliance during its early stages. The command structures put in place are designed for a carrier with the ability to carry out four fighter squadrons. Colosseum dictated the way future carriers are specified, and it is the sole reason why captains wanted to stick with the four-bay design.",,,
toopo_dramster,SHIP,"Dramster is a conversion of a Dram with its notable fuel tanks removed. It has been cut, rearranged, and reassembled and the result of this process is this light frigate. As Dram's engines are quite powerful, Dramster is quite fast and doesn't lose its speed even with some additional armor plating attached. Some say it is a poor man's Omen, due to a makeshift EMP emitter being installed. Still, as this vessel is an amalgamation of Dram parts, it cannot take hits and disintegrates under enemy fire quickly. Especially if it is forced to fight anything bigger than itself.",,,
toopo_apoture,SHIP,"An answer to the prayers for salvage captains whose requirements include a launch bay. The best-selling survey hull through cycles 203 to 205, even the upcoming cycle 206 looks like it's still the best seller in its class. Apparatus is the epitome of the Power Jinx R&D's blueprint hacking prowess, equipped with a deadly array of missile mounts, a Large Energy mount, and the power and shield system from Apogee. This ship can kick and eat jabs with its mighty 360-degree shield. A favourite of the lone captains and a common sight in survey fleets.",,,
toopo_xplorer,SHIP,"An incredible feat of data mining and blueprint hacking. Multiple different sources were connected and mixed in a controlled way to achieve the resulting hull design. Mutant was an instant success in the survey hull market. A very modular weapon design that allows it to work in multiple different fleet designations. One of the strongest frontal shields in the sector thanks to a technology only seen in the more higher-tech military ships. It can hold its position in battle in a tight line longer than most ships, the maneuvering engines provide it with fast turning speed. Its biggest weakness is against multiple flanking ships, you can only point the shield at one of them.",,,
toopo_miningboi,SHIP,"Radiator is an old mining frigate, originally made as a competitor to the Shepherd drone tender. It never beat Shepherd in reviews as it was hard to beat the accurate drones for mining purposes. Radiator was made to wield a large blaster that just obliterates asteroids, and the crew was supposed to handle the ore retrieval with heavy machinery. This requirement of having more spacers that had to be paid monthly wages was ultimately the reason for its commercial failure. The original blueprint was datamined and updated by Power Jinx R&D to wield any kind of energy weapon on its front. It lacks a modern shield, but has a damper device to protect itself from detonated asteroid pieces, or weapon fire if you find yourself in the wrong place.",,,
toopo_trooperboi,SHIP,"This version of the Radiator has been modified to transfer troops. Power Jinx R&D claims it's painted with an ancient camouflage that'll make you invisible in a Terran environment. Most of the complicated energy systems have been removed and replaced with a life support system to support new cramped living quarters. A fast troop deploy gate system now stands instead of the usual frontal energy mount. Its weapon mount arrangement has been changed to fit a more flux-friendly ballistic system and the sensor apparatus has been removed to make room for a missile mount.

Radiator is an old mining frigate, originally made as a competitor to the Shepherd drone tender. It never beat Shepherd in reviews as it was hard to beat the accurate drones for mining purposes. Radiator was made to wield a large blaster that just obliterates asteroids, and the crew was supposed to handle the ore retrieval with heavy machinery. This requirement of having more spacers that had to be paid monthly wages was ultimately the reason for its commercial failure. The original blueprint was data mined and updated by Power Jinx R&D to wield any kind of energy weapon on its front. It lacks a modern shield, but has a damper device to protect itself from detonated asteroid pieces, or weapon fire if you find yourself in the wrong place.",,,
toopo_ecuador,SHIP,"A new, better Condor now in light cruiser size. The hull has gone through a full round of improvements. A heavy-duty capacitator system resides in the roomier hull, enabling much larger weapon mounts, and an additional set of armor plates give it the much-needed protection. It's now a full-blown battleship, able to guard a wider surrounding area with a combination of weapons and fighters.

The odd name comes from an ageless multimedia art piece, still loudly performed from time to time in certain spacer circles. There is a legend that this piece of art originated from the mythical planet Earth. The meaning of the word Ecuador is lost, but the word has persisted through ages along with the song.",,,
toopo_egg,SHIP,"Egg-class heavy frigates are a popular new addition to any military fleet. While they are suited to hold a line formation along with the bigger ships, you will gain more return to your investment by letting them roam the flanks as they are a speedier alternative to provide constant pressure on the enemy formation.

In battle, it acts much akin to the larger Eagle-class. The Egg tries to control the distance and to provide constant pressure with its numerous forward-facing mounts, a mix of small ballistic hardpoints, and energy turrets. The Egg can maintain its preferred distance, and if needed retreat unscathed, with its maneuvering jets.

While the hull is considered to be on the heavier frigate size. It will be outmatched by bigger vessels if you stay in range, and it cannot handle any amount of strike craft.

The blueprint is of older Domain design, and the Egg's use in an actual battle has been questioned. One of the theories is that it was a part of a large collection of design prototypes that tried to ride on the popularity of Eagle-class cruiser, a hull that was never mass-produced. Somehow the blueprint has resurfaced and it's now marketed as a fully functional warship.",,,
toopo_haast,SHIP,"The long-lost Haast-class Battleship blueprint has found its way back to the Persean sector. An old Domain design that was never as popular as the other larger battleships of its day. It was originally part of a prototype fleet design, acting as the fleet's capital. The fleet rode on the popular Eagle design, but the non-cruiser-sized Eagle style models never caught the eye of a wider audience.

Best, and maybe the worst part of the design is that it has to be used in the same manner as the Eagle-class cruiser. Holding a line and perfect distance for its huge array of energy weapons to slowly chew out the opposing force. The large armor surface negates some of its ability to dissipate flux as efficiently as its weaponry might require. The lack of proper dissipation decreases the chances of using the full-frontal ballistic battery. Using it at the wrong time might cause an accidental overload.",,,
toopo_clown,SHIP,"Clown is a sturdy light cruiser. A slow, well-armored and armed wedge that will gladly stand in the way of damage. Not speedy by any means, and will easily crawl behind faster ships and miss the first exchange of blows. The usual designation is as a line cruiser, while it is not as mobile as the famed Eagle and Falcon, it is protected by a damper field system. It fills a niche between a Dominator and Enforcer.",,,
toopo_tsunami,SHIP,"Each Tsunami comes with an additional module. The modules can range from logistic solutions to different combat modules. The main module contains an impressive array of weapon mounts, while the engines are fitted with a Plasma Burn device to help the ship move quickly around the battlefield. Tsunami-class ships house the most modern versions of highly automated ship maintenance systems in the Persean sector. The legal department of Power Jinx R&D has continuously protected the company from the accusations of allegedly using dangerous AI designs in the Tsunami-class ships. The Tsunami requires much less crew than any other ship of its size, par a fully autonomous ship.

This version of the Tsunami houses a front-facing ballistic battery at its front module slot. The module houses four medium ballistic hardpoints, along with two small ballistic turret mounts.",,,
toopo_tsunamic,SHIP,"Each Tsunami comes with an additional module. The modules can range from logistic solutions to different combat modules. The main module contains an impressive array of weapon mounts, while the engines are fitted with a Plasma Burn device to help the ship move quickly around the battlefield. Tsunami-class ships house the most modern versions of highly automated ship maintenance systems in the Persean sector. The legal department of Power Jinx R&D has continuously protected the company from the accusations of allegedly using dangerous AI designs in the Tsunami-class ships. The Tsunami requires much less crew than any other ship of its size, par a fully autonomous ship.

This carrier version of the Tsunami comes with a module that is equipped with a hybrid turret mount and two launch bays. It has a fully working carrier-class nanoforge and two launch bays.",,,
oas_hml,WEAPON,"This is a big Laser meant to cut ship hulls and asteroids into pieces. A proprietary, special-purpose liquid hydrogen cooling system is required to mount the laser. A special certification process must be met by the ship hull, and a high-cost course must be passed by the crew members whose job is to maintain the system. This stopped the adoption of the tool quickly and the design decisions caused careers to end prematurely. Rumor has it that the laser never hit the required profit margins it was meant to.",,,
oas_s_cannon,WEAPON,"A magnetic system triggers the kinetic payload rotation inside the small bullet much faster, enabling this version of the Magnetron series to shoot at a much faster rate of fire than its bigger siblings. The only limiting factor is the ammo feeding system, not being able to keep up with the gun's output in the cramped room of a small mount.",,,
oas_s_pd,WEAPON,"This point defense weapon contains an ammunition buffering system. The gun can do quick bursts toward incoming missiles and fighters. Continuous firing causes the barrel's thermal protection systems to kick in, making it a more spray and pray type of weapon.",,,
oas_s_pd_fighter,WEAPON,"This point defense weapon contains an ammunition buffering system. The gun can do quick bursts toward incoming missiles and fighters. Continuous firing causes the barrel's thermal protection systems to kick in, making it a more spray and pray type of weapon.",,,
oas_m_cannon,WEAPON,Medium-sized Magnetron cannon shoots projectiles that are very effective against shields. Its accurate fire allows for constant pressure even at long range.,,,
oas_m_blazer,WEAPON,"Two thermal shapers transform molten mass into a wide, thin arc of plasma that gets propelled forward by controlled combustion. Upon hitting the hull, the plasma arc cuts through matter like butter. The massive thermal flux that roams inside the thermal shaper makes the resulting projectile trajectory hard to predict, making accurate corrections to the recoil impossible by common means resulting in a below average accuracy.",,,
oas_m_pd,WEAPON,"The double-barreled version of the Star Sprayer can saturate the space around any ship with its kinetic bullet storm. According to an infamous marketing sheet, it creates a ballistic protecting dome around the ship. When a missile finally gets past this imaginary dome, a ship's captain is usually the first to have a go at the running joke about the gun's name.",,,
oas_xlcannon,WEAPON,"A heavy projectile gets propelled by chemical combustion. The coil system activates hundreds of smaller objects inside the primary shell to spin around in a superconductive magnetic field. Upon impact, the fast circling kinetic payload gets released, ripping apart energy shields and ship hulls.",,,
oas_xl_blazer,WEAPON,Voted as the most efficient pirate repellant around the Persean system. The largely shaped plasma arcs destroy the will of any opposing force that dares to come close enough. There's not a single spacer who would willingly want to see a thin plasma arc cut through their crewmates.,,,
oas_trident_large,WEAPON,The ultimate long-range missile system. Each Trident missile unveils three harpoon-class submunitions upon reaching its target. This large mounting fires a triple salvo of Tridents and is likely to be the first weapon fired in an engagement as the last.,,,
oas_miningblaster_fighter,WEAPON,"The miner's best friend in a miniature size, this weapon can deliver pulverizing bolts of energy at medium range, albeit at an extreme cost in flux.",,,
oas_l_miningblaster,WEAPON,"The miner's best friend in a overcompensated size, this weapon can deliver pulverizing bolts of energy at medium range, albeit at an extreme cost in flux.",,,
oas_l_pd_mining,WEAPON,"AADS is An early version of the Paladin PD System deployed in mobile Hexagon mining stations. This Mid Expansion Epoch version of the system is not modular, as it requires a proprietary connection to the computing capabilities of the mothership. The capacitors are not as large as what the later modular version has. Nonetheless, upgraded with new targeting specifications meant for combat, it can act as a formidable point defense weapon.",,,
oas_m_energy,WEAPON,"Antimatter Pulse Blaster modified to fit in a standard mount. Instead of being integrated into the ship's antimatter tank, it uses an internal portable tank. As antimatter is volatile by nature, it requires certain precautions and bulk to keep it safely contained, increasing the size of the gun without direct integration to ship tanks. Sophisticated antimatter handling protocols control the process more accurately, allowing for smaller dosages and directed burst fire. The dose of antimatter per blast is so low that the weapon requires refills only during regular maintenance.",,,
oas_l_energy,WEAPON,"Antimatter Autopulser is the bigger portable version of Antimatter Blaster. The housing has grown enough to make way for a more effective autoload mechanism. The autoloader prepares antimatter in larger patches, allowing the gun to be fired and operated during this time.",,,
oas_phasey_big,WEAPON,"Hitting a shield with a nicely timed Snapper is a great way to cause overload. Snapper missiles are purpose-built kinetic anti-shield missiles. Snapper contains a bulky kinetic Plutonium penetrator encased in a guided rocket propulsion system. The kinetic penetrator's shape disrupts the oscillations of the energy shield system on impact. The force of the massive penetrator generates energy waves at designed frequencies, nullifying and amplifying waveforms within the flux system, causing energy fluctuations you'd generally want to avoid in the ship's flux capacitors.",,,
oas_phasey_big_rear,WEAPON,The ultimate long-range missile system. Each Trident missile unveils three harpoon-class submunitions upon reaching its target. This integrated mounting fires two Tridents and is likely to be the first weapon fired in an engagement as the last.,,,
oas_phasey_small,WEAPON,"This bomb bay contains an automated bomb unloader that can launch an entire row of bombs faster than a standard Piranha bomber. The bombs are equipped with a tiny graviton accelerator, adjusting the course and accelerating the bomb towards the target, enabling accurate bombing runs during unconventional maneuvers.",,,
oas_s_matchstick_fighter,WEAPON,A small torpedo launcher equipped with a single matchstick torpedos. The torpedos are weak but reliable and cheap to manufacture.,,,
oas_s_matchstick_bomber,WEAPON,A small torpedo launcher equipped with two matchstick torpedos. The torpedos are weak but reliable and cheap to manufacture.,,,
toopo_hound_rocket,WEAPON,"A Hound ship has to be butchered in the making of a Dogleg torpedo. An active antimatter warhead replaces the top fuel storage unit of the engine, reaper style. Even the most enormous ships can fall to this torpedo if struck directly in the hull.",,,
ameg_tanker_blaster,WEAPON,"A deadly Antimatter pulse blaster is fed directly by an antimatter tank on the ship hull. Unlike the basic AM blaster, this one utilizes much more sophisticated Antimatter handling protocols enabling it to control the annihilation process more accurately, allowing for smaller dosages and burst fire.",,,
oas_miniblaster_fighter,WEAPON,"A miniature version of the Heavy Blaster. Fires bolts of energy at enemy targets. With high damage and flux costs, the heavy blaster is one of the most damaging weapons for its size.

A reliable energy weapon, the Mini Blaster uses improved high-energy gas ammunition which, when activated by a strong electric current, is converted into plasma. A guiding electron is fired along the axis of traversal beforehand, ensuring that the uncontained plasma bolt will travel in the intended direction, thanks to physics that are no longer well understood.",,,
oas_orb_spectator,WEAPON,"The inside of the Osiris Radar Ball(ORB) is full of weird electrical devices and sensor arrays that seem to measure everything happening within the imminent space. The ORB can focus the ship's energy into a short burst laser in addition to acting as a radar. The energy level of the laser is amplified during ship system usage, which is usually linked with the ORB.",,,
oas_orb_gazer,WEAPON,"The inside of the Osiris Radar Ball(ORB) is full of weird electrical devices and sensor arrays that seem to measure everything happening within the imminent space. The ORB can focus the ship's energy into a short burst laser in addition to acting as a radar. The energy level of the laser is amplified during ship system usage, which is usually linked with the ORB.",,,
oas_orb_observer,WEAPON,"The inside of the Osiris Radar Ball(ORB) is full of weird electrical devices and sensor arrays that seem to measure everything happening within the imminent space. The ORB can focus the ship's energy into a short burst laser in addition to acting as a radar. The energy level of the laser is amplified during ship system usage, which is usually linked with the ORB.",,,
oas_orb_sun,WEAPON,"The inside of the Osiris Radar Ball(ORB) is full of weird electrical devices and sensor arrays that seem to measure everything happening within the imminent space. The ORB can focus the ship's energy into a short burst laser in addition to acting as a radar. The energy level of the laser is amplified during ship system usage, which is usually linked with the ORB.",,,
oas_s_cannon_fighter,WEAPON,"A magnetic system triggers the kinetic payload rotation inside the small bullet much faster, enabling this version of the Magnetron series to shoot at a much faster rate of fire than its bigger siblings. The only limiting factor is the ammo feeding system, not being able to keep up with the gun's output in the cramped room of a small mount.",,,
oas_l_pd,WEAPON,"Nova is the brightest Star in the weapon lineup. The wide, flat magnetic barrel shoots fast kinetic projectiles in a wide arc. A single bullet contains p-phase coupled anti-alpha particles. Any rupture in the containment shell causes a violent kinetic burst of super fast particles, an explosion-like effect that is no explosion, but the result looks the same. Each bullet tip contains a proximity fuse that gets triggered by any object with a mass.",,,
oas_m_poor_cannon,WEAPON,"The cannon got mass-produced during the early Domain expansion era. It is so common and affordable that you cannot find a spacer who has not come to either love or hate it. No one claims it rules modern combat, far from it when it cannot pressure energy shields with flux build-up. It's a cheap legacy instrument that does the job, but not something you should keep over the competition.",,,
oas_l_shottie,WEAPON,"The monstrous double cannon shoots huge blazing heavy metal balls containing explosive cores. During the pre-collapse Domain, the weapon was banned from use within ten light-years of population centers due to highly inaccurate firing patterns. The weapon blueprints resurfaced quickly after the collapse and have been in constant use as the value of life has permanently deflated.",,,
oas_m_shottie,WEAPON,"A big brown gun shooting out ""berries"" in an inaccurate arc. The little brother of the Big Berry cannon. Surprisingly effective in the right hands and range. The more you shoot without letting the weapon cool down, the more inaccurate it gets. It can do suppression fire on far-away targets, yet it's more efficient in close-range engagements.",,,
oas_s_shottie,WEAPON,"A miniature Berry cannon that can only shoot a single berry at once. Picking up a Ballblast requires more than a usually confident captain. Inaccuracy and slow firing rate are not the best selling points, but the way the berries strip armor and hull more than make up for it.",,,
oas_s_shottie_fighter,WEAPON,"The miniature version of the Ballburst cannon shoots a bunch of berries, smaller than the larger modular versions. This version lacks the hull penetrating power of a large berry projectile, but when used in larger quantities, even bigger ships need to take care when facing it in battle.",,,
oas_m_trident,WEAPON,The ultimate long-range missile system. Each Trident missile unveils three harpoon-class submunitions upon reaching its target. This medium mounting fires a single Trident and is a potent finisher from a long range.,,,
oas_m_kinetic2_missile,WEAPON,"Pecker is a terrifying launch platform for any ship getting too close to be in its range. Its only job is to aid a ship in brawling range to overload the enemy shield. The volatile solid fuel propellant of the missile is toxic and very potent, making the projectile fast enough to swing by PD weapons. The guidance system contains state-of-the-art tracking capability from the late Domain expansion era.",,,
oas_l_benergy,WEAPON,"G1 is the pinnacle of post-collapse weapon blueprint design. A reasonable person could argue it has to be a creation from the pre-collapse era, although the manufacturer claims it's a new invention. A supposed combination of the best currently known technical solutions and Domain-era components working together. It cannot match the damage or the flux efficiency of some of the pre-collapse designs. The weapon's better range gives a tactical advance over many, more efficient guns.",,,
