id,type,text1,text2,text3,notes
oas_m_benergy,WEAPON,"A simple weapon, it's claimed to have been created by the top minds in the Persean sector, with the current levels of understanding of physics mixed with a bunch of precollapse technologies to achieve a working weapon. Easy to use and maintain without the need to understand how it works. Ammunition goes in a receiver; a bullet gets shot out of the barrel. The ammunitions neutrons and electrons get ripped off when shot through the barrel, making it a highly destructive Proton impactor.",,,
oas_s_benergy,WEAPON,"""The weapon works perfectly in a lab environment, shredding shields and armor. But in actual combat trials, which you told me would be a waste of everyone's time, suggest that it's too hotheaded on our ships, par a few niche use cases. Need I also remind you that the original contract only specified the G1- and G2-Proton. So do not expect us to pay the invoice.

Ps. Osiris himself personally cooked the Volturnian lobster you sent. It had a sour taste even after steaming it with the G5X.""",- OA Dep. of Acquisitions,,
oas_s_cracker_fighter,WEAPON,"An early expansion relic that shoots ammunition, it lacks enough punch to do anything on modern shields and armor.",,,
oas_s_cracker,WEAPON,Quadquaker was a tool made to cut the surface of asteroids. Many rebels during the mid-expansion era found it passable as a weapon of war. The Quadquaker is exceedingly effective as an areal denial weapon against strike-craft. You can no longer come by one configured solely on mining tasks as the blueprint with the rebel firmware won the natural selection.,,,
oas_m_cracker,WEAPON,"An asteroid cracking tool, originally designated as ""Ferrite Cracker M86"" by the company that created it. Never designed for combat, the weapon became a central tool for the infamous rebel skipper Oba Baobab in a distant sector far away from the Persean sector. According to legends, Oba destroyed an onslaught from behind with a few well-placed hammers and an accelerated ammo-fed cracker. Domain architects quickly placed a ban on Cracker sales for civilians after the rebel incident.",,,
oas_l_orb_missile,WEAPON,"This slightly non-orthodox missile contains an electrically charged capacitator bank connected to a plasma coil. The launcher safely stores the precharged missiles. Upon launch, safety triggers get disconnected, and the onboard computer gets total control over the device. As the plasma coil leaks current, the control system gives any passing by enemy craft or missile a vicious zap. The missile triggers a complete discharge close to the target, bolting every last electron in a thunderous arc.",,,
ameg_lolslaught_blaster,WEAPON,"You are looking at the deadliest version of the Antimatter Pulse Blaster, capable of sending a never-ending stream of AM ammunition. The integration to the hull allows the gun to be fed directly from the ship's fuel containment units. Parts of the hull seem to act as a complicated venting surface, keeping the flux levels in check.",,,
oas_m_smartbomb,WEAPON,"This launcher is a modular bomb platform that enables a ship to deliver heavy explosive ordnance without crewed bombers. A built-in nanoforge supplies bombs indefinitely, keeping the space saturated with explosive ordnance. Each delivery vessel contains enough destructive power to bring down any frigate, most will easily dodge the bombs moving at a snail's pace. A heavy cruiser or a capital class ship has a much harder time moving out of the way of the destruction..",,,
oas_s_smartbomb,WEAPON,"This launcher is a modular bomb platform that enables a ship to deliver heavy explosive ordnance without crewed bombers. A built-in nanoforge supplies bombs indefinitely, keeping the space saturated with explosive ordnance. Each delivery vessel contains enough destructive power to bring down any frigate, most will easily dodge the bombs moving at a snail's pace. A heavy cruiser or a capital class ship has a much harder time moving out of the way of the destruction..",,,
oas_lg,WEAPON,"A simple short-range arc welder has been through modifications that amplify the per charge electric charge to dangerous levels, weaponizing the Welder. The weapon has impressive accuracy against anything that gets close enough to connect the high voltage circuit through the vacuum of space.",,,
oas_drone_missile,WEAPON,"No text, player should not see this.",,,
oas_l_hyper,WEAPON,"""I provided the hyper fluxer blueprint. The credits hit my account. I heard you hit the necessary flux efficiency margin and achieved the required armor penetration levels. Such a terrifying weapon you got now. Daud must be shivering in his pants. Tell the old man we are even and not to contact me ever again, unless it's for a drink. His [STATIC] would kill me if she ever finds out I aided you with this.""","- Unknown Tri-Tachyon personnel, COMSEC Intercept from Port Tse Franchise relay",,
oas_s_energy,WEAPON,"This EMP saturation weapon is from the mid-expansion era, created before the more accurate Ion Cannon took over the market. The inaccurate and energy-wasting physics made Domain Armada phase the device out soon after. The Thunder Baller saw most of its use as a scare weapon by criminals, preferring the flashier projectile array over actual combat results.",,,
toopo_m_fallen_eagle_flamethrower,WEAPON,"""The Port Tse engineers were reluctant to do what I wanted. Turning the shuttle, with all of them aboard, into a blazing fireball was the best motivational acts of my career as a pirate. Surviving the experience inside the shuttle made them realize that the weapon really needed their finely craftmanship skills. Afterwards, I did reward them with another round. Let the record show that the flamethrower worked that time.""",-Captains log,,
toopo_solace_l_lazer,WEAPON,"Rebel Laser L1 is the primary laser emitter on the Solace. A high performance armor destroying beam fed by the built-in capacitors inside the ship's hull. The Domain architects were frightened of any Onslaught captain rebelling against them. The laser is a literal relief to the thought, as it can penetrate capital class armor.",,,
toopo_solace_s_l_lazer,WEAPON,The L3 acts as a tertiary supplement in armor breaching needs. Useful when you don't need the full power of the L1 against smaller vessels and less armored targets.,,,
toopo_solace_s_r_lazer,WEAPON,The L3 acts as a tertiary supplement in armor breaching needs. Useful when you don't need the full power of the L1 against smaller vessels and less armored targets.,,,
oas_s_kineticmissile,WEAPON,"Hitting a shield with a nicely timed Snapper is a great way to cause overload. Snapper missiles are purpose-built kinetic anti-shield missiles. Snapper contains a bulky kinetic Plutonium penetrator encased in a guided rocket propulsion system. The kinetic penetrator's shape disrupts the oscillations of the energy shield system on impact. The force of the massive penetrator generates energy waves at designed frequencies, nullifying and amplifying waveforms within the flux system, causing energy fluctuations you'd generally want to avoid in the ship's flux capacitors.",,,
oas_s_kineticmissile_p,WEAPON,"The guidance system has been stripped out and the kinetic warhead seems to be missing along with the protective shell, most likely sold in the black market. The innards have been replaced by a large quantity of makeshift explosives. The stylish flame paint job seems to be the only saving grace as the missile was turned into a dumbfire torpedo.",,,
ballisticdrive,SHIP_SYSTEM,Power from the shields are used to temporarily boost the ammunition feeders and the engines.,Offensive,Power from the shields are used to temporarily boost the ammunition feeders and the engines.,
ballisticmaneuver,SHIP_SYSTEM,Boosts the ammunition feeders and allows the ship to do impressive maneuvers with guns blazing.,Offensive,Boosts the ammunition feeders and allows the ship to do impressive maneuvers with guns blazing.,
targetingassistant,SHIP_SYSTEM,"The onboard ORB will provide more accurate targeting data, boosting recoil, projectile speed and range of ballistic weapons.",Offensive,"The onboard ORB will provide more accurate targeting data, boosting recoil, projectile speed and range of ballistic weapons.",
toopo_advanced_burndrive,SHIP_SYSTEM,Fires the main burn drive in a more controlled manner while retaining some maneuverability. The massive speed boost comes at the cost of not being able to use shields. Collisions can cause catastrophic engine flameouts.,Movement,Fires the main burn drive in a more controlled manner while retaining some maneuverability. The massive speed boost comes at the cost of not being able to use shields. Collisions can cause catastrophic engine flameouts.,
toopo_makeshift_emp,SHIP_SYSTEM,"Activates an EMP generator. Nearby missiles, fighters, weapon emplacements, and engines of enemy ships are all targeted and can be disabled in short order.

Unfortunately, onboard weapon systems must be shut down to provide power for this device. The EMP pulses are also not very effective against enemy shields.",Special,"Generates lightning arcs that quickly knock out enemy missiles, weapons, and engines within the range. Mostly negated by shields.",
oas_timedilation,SHIP_SYSTEM,"Allows the ship to dilate time and space around the ship. Enabling the ship to travel larger distances in a short time (for the outside observer). For anyone inside the ship, time outside the field seems to stop to a crawl. The dilation field makes it impossible for weapons to acquire targets, so their energy is used to feed the Time dilator instead.",Movement,Enables the ship to travel larger distances in a short time (for the outside observer). The dilation field makes it impossible for weapons to acquire targets.,
oas_timedilation_ameg,SHIP_SYSTEM,"Allows the ship to dilate time and space around the ship. Enabling the ship to travel larger distances in a short time (for the outside observer). For anyone inside the ship, time outside the field seems to stop to a crawl. The dilation field makes it impossible for weapons to acquire targets, so their energy is used to feed the Time dilator instead.",Movement,Enables the ship to travel larger distances in a short time (for the outside observer). The dilation field makes it impossible for weapons to acquire targets.,
oas_timedilation_ameg_x,SHIP_SYSTEM,"Allows the ship to dilate time and space in a single axis around the ship. Enabling the ship to travel forward or backward. For those inside the ship, time outside seems to stop to a crawl. The single-axis dilation field is a simpler spacetime modification and allows weapons to fire normally.",Movement,Enables the ship to travel quickly in a short time in a single axis(forward or backwards).,
oas_sunboost,SHIP_SYSTEM,"Links the Osiris Radar Ball(ORB) with nearby ships, boosting weapons range and creating a time dilation field whose power depends upon the ship size.",Special,"Boost nearby ships' weapon range and give them a time dilation bonus. If no allies in range, the ship boosts itself.",
oas_drone_strike,SHIP_SYSTEM,"The ORB transmits a large power charge along with target instructions to a single Retinator drone, launching it in a self-sacrificing attack towards the target. The drone's Snapper core gets activated and matched with the target shield's harmonic data.",Offensive,Launches one of the Retinator drones into a self-sacrificing attack with a shield penetrating kinetic payload.,
oas_orb_activate,SHIP_SYSTEM,"Initiates overflux power protocols, aided by the processing prowess of the ORB device. Engine power and weapon rate of fire are boosted for a short period of time. Generates a time and space dilating wave on activation.",Offensive,Activates the ORB aided power core protocols that can only be uphold for a short period.,
station_harman,CUSTOM,This huge orbital fuel depot was created to make the large distance manageable to smaller trade fleets and convoys on their way to the Osiris Alliance territory. Some of the travelers get stuck here after spending their life savings on untrustworthy liner captains. The mining colony below is a good place as any for honest work when compared to any other planet in the Persean sector. All fleets wishing to fill their tanks here must have bought their share in advance from an auction system months before their trip.,,"The halls are full of people, most of them suffering from long-term effects of being in a closed space for too long. The station is split apart, those fortunate enough to have made their bids for fuel early in advance are treated like VIP customers. Everyone else is just left on their own. Courtesy of the Antimatter Energy Group that runs the place.",
planet_harman,CUSTOM,"A small mining colony far away from everything. The edge of the Osiris Alliance territory. The local mining industries are not important to anyone else but the locals. However, the fuel depot orbiting the planet is important, it's an important antimatter fuel resource on a route that lets convoys move freely between the core systems and the Bereer star system. The spaceport acts as a resting place and it has recently gained a boom in a surplus crew. Many passengers are looking for work as scamming travel organizers leave their customers stranded on the depot.",,"A small mining colony, you notice a Military base with the Osiris Alliance colors.",
planet_fura,CUSTOM,"A volcanic planet with ever-changing mountain ranges due to hourly tectonic activity. It hosts a small mining colony that has managed to survive through multiple catastrophic system wide events.",,"Fura is a fiery volcanic planet, covered by clouds of ash. The tectonic activity is caused mainly by the gravity of the gas giant Airo, gripping the planet into a tidal lock. There are a few moving mining platforms open for outside business. Domain aged computer forecasts predict where the tectonic activity hits next, allowing the populated platforms to move towards safer grounds. It's a constant battle against the planet, but the local populace wouldn't have it any other way.",
planet_vaultron,CUSTOM,"This planet has been bombarded to ruins. Covered in glass dust. It holds a vast array of technology treasures from the Domain era. While the surface is a dry desert, ruins are found under every dune, and underneath the large ruined cities are vast underground water reserves, built by the domain long ago. The planet has become a booming center for new entrepreneurs and it's now a home for thousands of new corporations fighting to become the next big thing.",,"Your sensors show hundreds, if not thousands of population hubs around the desert surface. The air is dry, a bit hot. Radio wave bandwidth is full of business chatter, commercials, and encrypted transmissions. You could choose to go to any one of the available market hubs to do your business. Active competition ensures you'll get the market value in prices.",
planet_magnetron,CUSTOM,"Vaultrons satellite planet. Plain rocky surface, no atmosphere. Completely lifeless except for a single large blip on a radar",,"The only settlement on the surface houses the Antimatter Energy Group headquarters and fuel production facilities. Seeing anything but tankers and business shuttles land here is rare.",
planet_eria,CUSTOM,"One the most pleasant climates one can find in the Persean system. Only a small part of the land is used, yet the planet could potentially feed half of the people in the Persean system. The planet is protected by a local military base.",,A single large military base is apparent in the vast sanctum paradise of what seems to be an infinite amount of organics and freshwater. Is this what the legendary Earth was like?,
planet_fugura,CUSTOM,"A forgotten Domain mining colony has been turned into a local pirate safe haven by its new habitats. The anarchist pirate captains of the planet usually keep a low profile, but occasionally cause trouble with the trade routes fueling at the Harman station when their supplies run low.",,"Cold and harsh world, the small population of misfit spacers and civilians who did not fit in the more civilized Harman colony reside here. Tribalism rules, and even on occasion anarchy, depending on which items are short in supply.",
osiris,FACTION,"Named after the legendary salvage captain Osiris Sun. The Osiris Alliance is ruled by a board of directors. Any corporate entity that has enough credits can buy a seat on the table. Against the original spirit of the Alliance, this fee seems to steadily raise. The Osiris Alliance is the entity responsible for the governing and military security of few planets that make up the alliance. Before the independence declaration, its main responsibility was to fight against pirates, during the AI wars it protected civilian populations as best as it could. After the declaration of free enterprise and independence, protection against possible invasions by other factions became the new focus for the Osiris Alliance military.

The Alliance was born with the idealogy of free enterprise. Anyone is free to join their world and start building their own enterprises. This has made the Alliance worlds gain a steady flow of people from the core Persean systems. The planets are full of Domain technology, ripe to be picked up and used again. Surprisingly, completely new technology has started to emerge from the ashes due to the free capitalistic system. Even natural monopolies are starting to emerge, causing internal stress and conflicts. Two of the companies by name are the Antimatter Energy Group, holding a monopoly in all things energy. And the Power Jinx R&D whose ship designs have made a lasting impression for their customers all around the sector.",,,
harman_abandoned_station,CUSTOM,"A huge domain era mining station, once constantly being fed materia from the Harman's belt.",,The abandoned mining station sits silently in space. Its vast hulk is a reminder of the days of Domain. Nothing in this scale could be build today.,